{
  "schema_version": "results_content.v1",
  "comparison_id": "0fefa93a76d08253",
  "run_id": "f6cc3910-35df-41c9-ba16-abdb5625248b",
  "analysis_version": "tribev2.2026.05",
  "generated_at": "2026-05-04T04:24:43.169343+00:00",
  "assets": {
    "recipe_library_version": "1.0",
    "chord_library_version": "1.0",
    "voice_exemplars_hash": "1f0417fa2af2",
    "prompt_templates_hash": "9d5b8d3e132b",
    "slot_defaults_hash": "1bf38d36293b"
  },
  "videos": {
    "video_a": {
      "id": "vox-meaning-2024-11",
      "display_name": "Vox",
      "creator": "Vox",
      "title": "The Search for the Meaning of the Universe",
      "duration_seconds": 60.0,
      "poster_path": null,
      "system_means": {
        "personal_resonance": 0.58,
        "attention": 0.61,
        "brain_effort": 0.52,
        "gut_reaction": 0.34,
        "memory_encoding": 0.61,
        "social_thinking": 0.55,
        "language_depth": 0.66
      },
      "system_peaks": {
        "personal_resonance": {
          "time": 8.0,
          "value": 0.71
        },
        "attention": {
          "time": 35.0,
          "value": 0.74
        },
        "brain_effort": {
          "time": 41.0,
          "value": 0.69
        },
        "gut_reaction": {
          "time": 12.0,
          "value": 0.48
        },
        "memory_encoding": {
          "time": 28.0,
          "value": 0.78
        },
        "social_thinking": {
          "time": 22.0,
          "value": 0.71
        },
        "language_depth": {
          "time": 35.0,
          "value": 0.81
        }
      },
      "chord_events": [
        {
          "chord_id": "story-integration",
          "timestamp_seconds": 28.0,
          "duration_seconds": 3.0,
          "quote": "And then a strange pattern emerged...",
          "formula_values": {}
        },
        {
          "chord_id": "social-resonance",
          "timestamp_seconds": 22.0,
          "duration_seconds": 2.0,
          "quote": "Carl Sagan wrote about this...",
          "formula_values": {}
        }
      ],
      "integration_score": 0.52,
      "hub_node": "memory_encoding",
      "timeseries": {
        "personal_resonance": [
          0.58,
          0.58,
          0.58,
          0.58,
          0.58,
          0.58,
          0.58,
          0.58,
          0.58,
          0.58,
          0.58,
          0.58,
          0.58,
          0.58,
          0.58,
          0.58,
          0.58,
          0.58,
          0.58,
          0.58,
          0.58,
          0.58,
          0.58,
          0.58,
          0.58,
          0.58,
          0.58,
          0.58,
          0.58,
          0.58,
          0.58,
          0.58,
          0.58,
          0.58,
          0.58,
          0.58,
          0.58,
          0.58,
          0.58,
          0.58,
          0.58,
          0.58,
          0.58,
          0.58,
          0.58,
          0.58,
          0.58,
          0.58,
          0.58,
          0.58,
          0.58,
          0.58,
          0.58,
          0.58,
          0.58,
          0.58,
          0.58,
          0.58,
          0.58,
          0.58,
          0.58
        ],
        "attention": [
          0.61,
          0.61,
          0.61,
          0.61,
          0.61,
          0.61,
          0.61,
          0.61,
          0.61,
          0.61,
          0.61,
          0.61,
          0.61,
          0.61,
          0.61,
          0.61,
          0.61,
          0.61,
          0.61,
          0.61,
          0.61,
          0.61,
          0.61,
          0.61,
          0.61,
          0.61,
          0.61,
          0.61,
          0.61,
          0.61,
          0.61,
          0.61,
          0.61,
          0.61,
          0.61,
          0.61,
          0.61,
          0.61,
          0.61,
          0.61,
          0.61,
          0.61,
          0.61,
          0.61,
          0.61,
          0.61,
          0.61,
          0.61,
          0.61,
          0.61,
          0.61,
          0.61,
          0.61,
          0.61,
          0.61,
          0.61,
          0.61,
          0.61,
          0.61,
          0.61,
          0.61
        ],
        "brain_effort": [
          0.52,
          0.52,
          0.52,
          0.52,
          0.52,
          0.52,
          0.52,
          0.52,
          0.52,
          0.52,
          0.52,
          0.52,
          0.52,
          0.52,
          0.52,
          0.52,
          0.52,
          0.52,
          0.52,
          0.52,
          0.52,
          0.52,
          0.52,
          0.52,
          0.52,
          0.52,
          0.52,
          0.52,
          0.52,
          0.52,
          0.52,
          0.52,
          0.52,
          0.52,
          0.52,
          0.52,
          0.52,
          0.52,
          0.52,
          0.52,
          0.52,
          0.52,
          0.52,
          0.52,
          0.52,
          0.52,
          0.52,
          0.52,
          0.52,
          0.52,
          0.52,
          0.52,
          0.52,
          0.52,
          0.52,
          0.52,
          0.52,
          0.52,
          0.52,
          0.52,
          0.52
        ],
        "gut_reaction": [
          0.34,
          0.34,
          0.34,
          0.34,
          0.34,
          0.34,
          0.34,
          0.34,
          0.34,
          0.34,
          0.34,
          0.34,
          0.34,
          0.34,
          0.34,
          0.34,
          0.34,
          0.34,
          0.34,
          0.34,
          0.34,
          0.34,
          0.34,
          0.34,
          0.34,
          0.34,
          0.34,
          0.34,
          0.34,
          0.34,
          0.34,
          0.34,
          0.34,
          0.34,
          0.34,
          0.34,
          0.34,
          0.34,
          0.34,
          0.34,
          0.34,
          0.34,
          0.34,
          0.34,
          0.34,
          0.34,
          0.34,
          0.34,
          0.34,
          0.34,
          0.34,
          0.34,
          0.34,
          0.34,
          0.34,
          0.34,
          0.34,
          0.34,
          0.34,
          0.34,
          0.34
        ],
        "memory_encoding": [
          0.61,
          0.61,
          0.61,
          0.61,
          0.61,
          0.61,
          0.61,
          0.61,
          0.61,
          0.61,
          0.61,
          0.61,
          0.61,
          0.61,
          0.61,
          0.61,
          0.61,
          0.61,
          0.61,
          0.61,
          0.61,
          0.61,
          0.61,
          0.61,
          0.61,
          0.61,
          0.61,
          0.61,
          0.61,
          0.61,
          0.61,
          0.61,
          0.61,
          0.61,
          0.61,
          0.61,
          0.61,
          0.61,
          0.61,
          0.61,
          0.61,
          0.61,
          0.61,
          0.61,
          0.61,
          0.61,
          0.61,
          0.61,
          0.61,
          0.61,
          0.61,
          0.61,
          0.61,
          0.61,
          0.61,
          0.61,
          0.61,
          0.61,
          0.61,
          0.61,
          0.61
        ],
        "social_thinking": [
          0.55,
          0.55,
          0.55,
          0.55,
          0.55,
          0.55,
          0.55,
          0.55,
          0.55,
          0.55,
          0.55,
          0.55,
          0.55,
          0.55,
          0.55,
          0.55,
          0.55,
          0.55,
          0.55,
          0.55,
          0.55,
          0.55,
          0.55,
          0.55,
          0.55,
          0.55,
          0.55,
          0.55,
          0.55,
          0.55,
          0.55,
          0.55,
          0.55,
          0.55,
          0.55,
          0.55,
          0.55,
          0.55,
          0.55,
          0.55,
          0.55,
          0.55,
          0.55,
          0.55,
          0.55,
          0.55,
          0.55,
          0.55,
          0.55,
          0.55,
          0.55,
          0.55,
          0.55,
          0.55,
          0.55,
          0.55,
          0.55,
          0.55,
          0.55,
          0.55,
          0.55
        ],
        "language_depth": [
          0.66,
          0.66,
          0.66,
          0.66,
          0.66,
          0.66,
          0.66,
          0.66,
          0.66,
          0.66,
          0.66,
          0.66,
          0.66,
          0.66,
          0.66,
          0.66,
          0.66,
          0.66,
          0.66,
          0.66,
          0.66,
          0.66,
          0.66,
          0.66,
          0.66,
          0.66,
          0.66,
          0.66,
          0.66,
          0.66,
          0.66,
          0.66,
          0.66,
          0.66,
          0.66,
          0.66,
          0.66,
          0.66,
          0.66,
          0.66,
          0.66,
          0.66,
          0.66,
          0.66,
          0.66,
          0.66,
          0.66,
          0.66,
          0.66,
          0.66,
          0.66,
          0.66,
          0.66,
          0.66,
          0.66,
          0.66,
          0.66,
          0.66,
          0.66,
          0.66,
          0.66
        ]
      },
      "coupling_matrix": [
        [
          1.0,
          0.0,
          0.0,
          0.21,
          0.0,
          0.0,
          0.0
        ],
        [
          0.0,
          1.0,
          0.0,
          0.0,
          0.0,
          0.0,
          0.0
        ],
        [
          0.0,
          0.0,
          1.0,
          0.0,
          0.0,
          0.0,
          0.0
        ],
        [
          0.21,
          0.0,
          0.0,
          1.0,
          0.0,
          0.0,
          0.0
        ],
        [
          0.0,
          0.0,
          0.0,
          0.0,
          1.0,
          0.62,
          0.58
        ],
        [
          0.0,
          0.0,
          0.0,
          0.0,
          0.62,